{
  "headerInfo": {
    "patientName": "袁英",
    "patientGender": "女",
    "latestAge": 50,
    "yearRange": "2022-2025"
  },
  "keyVitals": {
    "exams": [
      {
        "examDate": "2022-10-26",
        "age": 47
      },
      {
        "examDate": "2023-10-27",
        "age": 48
      },
      {
        "examDate": "2024-10-28",
        "age": 49
      },
      {
        "examDate": "2025-10-29",
        "age": 50
      }
    ],
    "metrics": [
      {
        "name": "身高 (cm)",
        "values": [
          "159.5",
          "159.5",
          "159.5",
          "159.5"
        ]
      },
      {
        "name": "体重 (kg)",
        "values": [
          "58.0",
          "59.0",
          "60.5",
          "59.8"
        ]
      },
      {
        "name": "BMI (kg/m²)",
        "values": [
          "22.8",
          "23.2",
          "23.7",
          "23.4"
        ]
      },
      {
        "name": "血压 (mmHg)",
        "values": [
          "115/60",
          "117/63",
          "120/65",
          "118/66"
        ]
      }
    ]
  },
  "aiSummary": {
    "title": "袁英女士 2022-2025 年度健康趋势总结",
    "introduction": "袁英女士，您好。这份报告总结了您从2022年到2025年（47岁至50岁）连续四年的体检数据。总体来看，您的健康状况在核心问题（如肺结节、乳腺结节）上保持稳定，并且在尿酸控制上取得了明显进步。当前的核心风险集中在持续偏高的血脂水平上。",
    "points": [
      "显著改善： 2023年发现的尿蛋白（++）问题已在后续两年中消失；血尿酸水平在饮食控制下已连续两年下降，趋势良好。",
      "保持稳定： 影像学检查显示，右肺上叶微小结节、双侧乳腺结节以及子宫肌层回声不均等问题，在四年追踪期内均未见不良变化，保持稳定。",
      "核心风险： 您的总胆固醇和脂蛋白a水平（如 2025年 5.95 mmol/L 和 452.0 mg/L）始终显著高于正常范围，这是心血管系统最需要关注的风险点。",
      "体重管理： 您的体重和BMI指数（22.8至23.7）均在正常范围内，但近三年略有波动，请继续保持。"
    ],
    "conclusion": "建议您在继续保持低嘌呤饮食、年度追踪肺部及乳腺结节的同时，将管理重点转向心血管健康。请务必咨询心内科医生，评估是否需要启动降脂药物治疗，以控制持续偏高的总胆固醇和脂蛋白a。"
  },
  "chartData": {
    "labels": [
      "2022-10-26",
      "2023-10-27",
      "2024-10-28",
      "2025-10-29"
    ],
    "bmiChart": {
      "weight": [
        58.0,
        59.0,
        60.5,
        59.8
      ],
      "bmi": [
        22.8,
        23.2,
        23.7,
        23.4
      ]
    },
    "lipidChart": {
      "totalCholesterol": [
        5.9,
        6.06,
        5.85,
        5.95
      ],
      "lipoproteinA": [
        451.2,
        456.6,
        450.0,
        452.0
      ]
    },
    "uricAcidChart": {
      "uricAcid": [
        395.5,
        403.3,
        380.0,
        350.0
      ]
    }
  },
  "statusSummary": {
    "improvements": [
      "血尿酸水平已连续两年下降 (2023年 403.3 -> 2025年 350.0)，饮食控制初见成效。",
      "2023年出现的尿蛋白（++）问题在2024年及2025年均已转阴，肾脏指标改善。"
    ],
    "risks": [
      "总胆固醇和脂蛋白a持续处于高位 (2025年分别为 5.95 mmol/L 和 452.0 mg/L)，心血管风险值得高度关注。",
      "右肺上叶微小结节（4mm）连续追踪稳定，虽良性可能大，仍需年度复查。",
      "双侧乳腺结节及子宫肌层回声不均情况稳定，需年度妇科随诊。",
      "血尿酸虽有改善，但仍高于女性正常范围 (350.0 umol/L)，需继续坚持低嘌呤饮食。"
    ]
  }
}