{
  "headerInfo": {
    "patientName": "袁英",
    "patientGender": "女",
    "latestAge": 48,
    "yearRange": "2022-2023"
  },
  "keyVitals": {
    "exams": [
      {
        "examDate": "2022-10-26",
        "age": 47
      },
      {
        "examDate": "2023-10-27",
        "age": 48
      }
    ],
    "metrics": [
      {
        "name": "体重 (kg)",
        "values": [
          "58.0",
          "59.0"
        ]
      },
      {
        "name": "BMI",
        "values": [
          "22.8",
          "23.2"
        ]
      },
      {
        "name": "血压 (mmHg)",
        "values": [
          "115/60",
          "117/63"
        ]
      }
    ]
  },
  "aiSummary": {
    "title": "综合评价 (2022-2023)",
    "introduction": "袁英女士，您好。本次报告整合了您2022年和2023年的体检数据。总体来看，您的核心健康指标如肝功能、血糖等保持稳定，但部分代谢指标（血脂、尿酸）持续异常，并出现了一些新的健康问题（肺结节、尿蛋白），需要您给予重点关注和跟进。",
    "points": [
      "保持稳定项：您的肝功能、血糖、甲状腺功能、肿瘤标志物等关键指标连续两年均在正常范围内，血压心率平稳，整体基础健康状况良好。",
      "持续风险项：血脂异常（总胆固醇、脂蛋白a）和高尿酸血症是长期存在的健康风险，且数值未见改善。此外，心脏瓣膜轻度反流和乳腺增生也为持续存在的问题，需要定期监测。",
      "新增关注点：2023年体检新发现右肺上叶微小结节和尿蛋白阳性(++)，这两项是需要优先处理的健康警示，务必遵医嘱进行专科复查以明确诊断。",
      "趋势变化：您的体重和BMI呈现轻微上升趋势，虽然目前仍在正常范围内，但应警惕其对血脂、尿酸等代谢指标的潜在影响。"
    ],
    "conclusion": "核心建议是：请尽快就新发现的“肺部结节”和“尿蛋白阳性”问题咨询呼吸内科和肾内科医生；同时，通过调整饮食和增加运动来管理血脂和尿酸。"
  },
  "chartData": {
    "labels": [
      "2022",
      "2023"
    ],
    "bmiChart": {
      "weight": [
        58.0,
        59.0
      ],
      "bmi": [
        22.8,
        23.2
      ]
    },
    "lipidChart": {
      "totalCholesterol": [
        5.9,
        6.06
      ],
      "lipoproteinA": [
        451.2,
        456.6
      ]
    },
    "uricAcidChart": {
      "uricAcid": [
        395.5,
        403.3
      ]
    }
  },
  "statusSummary": {
    "improvements": [
      "肝功能、血糖及甲状腺功能等核心生化指标保持稳定正常。",
      "肿瘤标志物连续两年均在正常范围内。",
      "血压和心率维持在理想水平。"
    ],
    "risks": [
      "新增肺部微小结节：2023年胸部CT发现右肺上叶微小结节，需遵医嘱进行随访复查。",
      "新增尿蛋白阳性：2023年尿常规检查发现尿蛋白(++)，可能提示肾脏功能变化，需肾内科专科就诊。",
      "血脂异常持续存在：总胆固醇、脂蛋白a连续两年偏高，提示心血管疾病风险需持续关注。",
      "高尿酸血症问题持续：血尿酸水平连续两年高于正常范围，痛风风险增加。",
      "乳腺问题持续存在：连续两年提示双侧乳腺小叶增生及结节，需定期复查。",
      "心脏瓣膜轻度反流：心脏超声连续两年提示二尖瓣及三尖瓣轻度反流，状态稳定但需随访。",
      "体重及BMI呈轻微上升趋势，需注意体重管理。"
    ]
  }
}